{
  "pipeline_schema_version": "2.0",
  "approval_id": "ap-1",
  "submission_id": "sub-1",
  "decision": "APPROVE",
  "approver_id": "trainer-1",
  "approver_role": "release-approver",
  "decided_at": "2026-10-15T00:00:00Z",
  "report_hash": "sha256:0000000000000000000000000000000000000000000000000000000000000000"
}
